<?xml version="1.0" encoding="UTF-8"?>
<pn:rss version="2.0" 
   xmlns:xsi="http://www.w3.org/2001/XMLSchema-instance" 
   xmlns:pn="http://www.processpuzzle.com/PartyNews"
   xsi:schemaLocation="http://www.processpuzzle.com/PartyNews http://processpuzzle.com/Schemas/PartyNews.xsd">
  <pn:channel>
    <pn:title>ProcessPuzzle</pn:title>
    <pn:link>http://processpuzzle.com</pn:link>
    <pn:description>ProcessPuzzle company news</pn:description>
    <pn:language>en-us</pn:language>
    <pn:pubDate>Tue, 10 Jun 2003 04:00:00 GMT</pn:pubDate>
    <pn:lastBuildDate>Tue, 10 Jun 2003 09:41:01 GMT</pn:lastBuildDate>
    <pn:docs>http://processpuzzle.com/rss</pn:docs>
    <pn:generator>ProcessPuzzle RSS Generator 2.0</pn:generator>
    <pn:managingEditor>Zsolt Zsuffa, zsolt.zsuffa@example.com</pn:managingEditor>
    <pn:webMaster>Peter Krima, peter.krima@example.com</pn:webMaster>    
    
    <pn:item>
		<pn:title>HONNIA furniture design service lunched</pn:title>
		<pn:link>http://honnia.hu/news</pn:link>
		<pn:description>Cerasus Llc. lunched a new woldwide available furniture design service based on ProcessPuzzle.</pn:description>
		<pn:pubDate>Tue, 03 Jun 2003 09:39:21 GMT</pn:pubDate>
		<pn:guid>http://processpuzzle.com#item573</pn:guid>
    </pn:item>  
    
    <pn:item>
		<pn:title>ProcessPuzzle NewsReaderWidget is ready to use</pn:title>
		<pn:link>http://processpuzzle.com/news</pn:link>
		<pn:description>IT Codex Llc. released a new browser wiget for it's well known ProcessPuzzle framework.</pn:description>
		<pn:pubDate>Tue, 03 Jun 2003 09:39:21 GMT</pn:pubDate>
		<pn:guid>http://processpuzzle.com#item575</pn:guid>
    </pn:item>  
  </pn:channel>  
</pn:rss>

