<?xml version="1.0" encoding="UTF-8"?>
<pn:rss version="2.0" 
   xmlns:xsi="http://www.w3.org/2001/XMLSchema-instance" 
   xmlns:pn="http://www.processpuzzle.com/PartyNews"
   xsi:schemaLocation="http://www.processpuzzle.com/PartyNews http://processpuzzle.com/Schemas/PartyNews.xsd">
   <pn:channel>
      <pn:title>ProcessPuzzle</pn:title>
      <pn:link>http://processpuzzle.com</pn:link>
      <pn:description>ProcessPuzzle company news.</pn:description>
      <pn:language>en-us</pn:language>
      <pn:pubDate>Tue, 10 Jun 2003 04:00:00 GMT</pn:pubDate>
      <pn:lastBuildDate>Tue, 10 Jun 2003 09:41:01 GMT</pn:lastBuildDate>
      <pn:docs>http://processpuzzle.com/rss</pn:docs>
      <pn:generator>Weblog Editor 2.0</pn:generator>
      <pn:managingEditor>zsolt.zsuffa@example.com</pn:managingEditor>
      <pn:webMaster>peter.krima@example.com</pn:webMaster>    
    
      <pn:item>
         <pn:title>HONNIA furniture design service lunched</pn:title>
         <pn:link>Content/WidgetExamples/NewsDetail.xml?contentUri='Content/WidgetExamples/SiteNews.xml'&amp;documentVariables={index:'1'}&amp;documentType=SMART</pn:link>
         <pn:description>Cerasus Llc. launched a new worldwide available furniture design service based on ProcessPuzzle. Design your own furniture, exactly in a style which fits into you existing furnitures, specify size accomodates to your room.</pn:description>
         <pn:pubDate>Tue, 03 Jun 2003 09:39:21 GMT</pn:pubDate>
         <pn:guid>http://processpuzzle.com#item573</pn:guid>
      </pn:item>  
    
      <pn:item>
         <pn:title>ProcessPuzzle NewsReaderWidget is ready to use</pn:title>
         <pn:link>Content/WidgetExamples/NewsDetail.xml?contentUri='Content/WidgetExamples/SiteNews.xml'&amp;documentVariables={index:'2'}&amp;documentType=SMART</pn:link>
         <pn:description>IT Codex Llc. released a new browser wiget for it's well known ProcessPuzzle framework. NewsReaderWidget displays RSS feed in a customizable way and can be embedded into any SmartDocument.</pn:description>
         <pn:pubDate>Tue, 03 Jun 2003 09:39:21 GMT</pn:pubDate>
         <pn:guid>http://processpuzzle.com#item575</pn:guid>
      </pn:item>  
  </pn:channel>  
</pn:rss>
