<?xml version="1.0" encoding="UTF-8"?>
<pn:rss version="2.0" 
   xmlns:xsi="http://www.w3.org/2001/XMLSchema-instance" 
   xmlns:pn="http://www.processpuzzle.com/PartyNews"
   xsi:schemaLocation="http://www.processpuzzle.com/PartyNews http://processpuzzle.com/Schemas/PartyNews.xsd">
   <pn:channel>
      <pn:title>ProcessPuzzle</pn:title>
      <pn:link>http://processpuzzle.com</pn:link>
      <pn:description>ProcessPuzzle friss híre.</pn:description>
      <pn:language>hu-hu</pn:language>
      <pn:pubDate>Tue, 10 Jun 2003 04:00:00 GMT</pn:pubDate>
      <pn:lastBuildDate>Tue, 10 Jun 2003 04:00:00 GMT</pn:lastBuildDate>
      <pn:docs>http://processpuzzle.com/rss</pn:docs>
      <pn:generator>Weblog Editor 2.0</pn:generator>
      <pn:managingEditor>zsolt.zsuffa@example.com</pn:managingEditor>
      <pn:webMaster>peter.krima@example.com</pn:webMaster>    
    
      <pn:item>
         <pn:title>HONNIA bútor tervezés</pn:title>
         <pn:link>http://honnia.hu/news</pn:link>
         <pn:description>Cerasus Kft. elindította új, a ProcessPuzzle üzleti platformra épülő, világszerte elérhető Internetes szolgáltatását. A Honniával postosan a saját stílusában tervezheti meg bútotát, éppen az adottságainak megfelelő méretben.</pn:description>
         <pn:pubDate>Tue, 10 Jun 2003 04:00:00 GMT</pn:pubDate>
         <pn:guid>http://processpuzzle.com#item573</pn:guid>
      </pn:item>  
    
      <pn:item>
         <pn:title>ProcessPuzzle hírolvasó komponens</pn:title>
         <pn:link>Content/WidgetExamples/UpcommingEvents.xml</pn:link>
         <pn:description>IT Kódex Kft. új felhasználói felület komponenst fejlesztett ki az RSS hírcsatornák megjelenítésére. A NewsReaderWidget a híreket testre szabható módon jeleníti meg és bármely okos dokumentumba beépíthető.</pn:description>
         <pn:pubDate>Tue, 03 Jun 2003 09:39:21 GMT</pn:pubDate>
         <pn:guid>http://processpuzzle.com#item575</pn:guid>
      </pn:item>  
  </pn:channel>  
</pn:rss>
