<?xml version="1.0" encoding="UTF-8"?>
<pn:rss version="2.0" 
   xmlns:xsi="http://www.w3.org/2001/XMLSchema-instance" 
   xmlns:pn="http://www.processpuzzle.com/PartyNews"
   xsi:schemaLocation="http://www.processpuzzle.com/PartyNews http://processpuzzle.com/Schemas/PartyNews.xsd">
   <pn:channel>
      <pn:title>Facebook Message Wall</pn:title>
      <pn:link>https://www.facebook.com/groups/processpuzzle/</pn:link>
      <pn:description>ProcessPuzzle - Facebook group</pn:description>
      <pn:language>hu-HU</pn:language>
      <pn:pubDate>Mon, 13 March 2012, 04:00:00 GMT</pn:pubDate>
      <pn:lastBuildDate>Mon, 13 March 2012, 04:00:00 GMT</pn:lastBuildDate>
      <pn:docs>https://www.facebook.com/groups/processpuzzle/rss</pn:docs>
      <pn:generator>Weblog Editor 2.0</pn:generator>
      <pn:managingEditor>zsolt.zsuffa@itkodex.hu</pn:managingEditor>
      <pn:webMaster>peter.krima@itkodex.hu</pn:webMaster>    
    
      <pn:item>
         <pn:title>Ákos Várhegyi joined to ProcessPuzzle team</pn:title>
         <pn:link>https://www.facebook.com/groups/processpuzzle</pn:link>
         <pn:description>
            With he's 20 years experience in complex system design he'll be strengthen the ProcessPuzzle Consultans group. He'll also lunch ProcessPuzzle Advisor Partner Program.
         </pn:description>
         <pn:pubDate>Mon, 05 March 2012, 09:39:21 GMT</pn:pubDate>
         <pn:guid>http://processpuzzle.com#item575</pn:guid>
      </pn:item>  
      
      <pn:item>
         <pn:title>Usability question: Toggle between edit and view mode makes sense?</pn:title>
         <pn:link>https://www.facebook.com/groups/processpuzzle/</pn:link>
         <pn:description>
            ProcessPuzzle follows the "Edit in-place if you're authorized." usability rule. There is no administrative UI, special UI for content management or workflow specification. 
            Consequently if you add a link to a TextElement of SmartDocument this link will work. This behavior seems to be logical, in the other hand clicking on link can navigate the user to another site. Can this harm the user?
            Does it makes sense to provide view and edit mode? (supposed the user is authorized)
         </pn:description>
         <pn:pubDate>Mon, 05 March 2012, 09:39:21 GMT</pn:pubDate>
         <pn:guid>http://processpuzzle.com#item575</pn:guid>
      </pn:item>  
  </pn:channel>  
</pn:rss>
